{
  "schema_version": "1.0",
  "receipt_id": "44d81c2b-0839-41b2-bab2-9ca58eefe794",
  "accepted_at": "2026-10-05T14:34:47.743542+00:00",
  "execution_id": "43911d90-45f3-4294-a281-1a401764003d",
  "dispatch_sha256": "2db52ee504ad6896c198ad7e02bfc9593c38d1f430c175b97302bbee651ae0f7",
  "task_id": "TASK-V3-LENS-REPRODUCIBILITY_IMPLEMENTATION",
  "task_sha256": "a9baaa3acd190239a7acfa588a35109a2784bdacb162a5c872f92d36fc9c28ea",
  "code_sha": "4139ca7b0b1ae72c0930801df5e50653b59a7e92",
  "input_hashes": {
    "assets/equations/EQ-01.png": "b0848eeb727db9efb715aefa5ab8549ca1acb077cea3f9e1e468f53987ca696f",
    "assets/equations/EQ-02.png": "d98492eaded304fb28634c78ebbe4eb01421118cb6b2bc4a98d52aae2ca9e990",
    "assets/equations/EQ-03.png": "a1b10809f7223c4b44b82d1e413980b5894c50f0f6a4bd454ca341e4f3396916",
    "assets/equations/EQ-04.png": "9d1f1e07e627987feafb8767e9ae16cb476e44b594d9a808a7764cb828bf426a",
    "assets/equations/EQ-05.png": "9a83dbf4553ec412edf50a07792bbf8fe5406f77e0988ebea319b19eeb700a6a",
    "assets/equations/EQ-08.png": "94a495e4d72db06e1b86d7bca89939319cf56688ba7f2dbc9dd5806c239e32da",
    "assets/equations/EQ-09.png": "1b31544daae73bf46373ba51eb6a9af7a6791d77d48341dd63d732a234eff217",
    "assets/equations/EQ-10.png": "a672448fd106824774a0d61f9c28d69f0e2c7e6a375f5fd4f6e10d77c554df5b",
    "assets/equations/EQ-11.png": "20e3f370fd493f8df3b7aea12c1562d06ff9554850ebf06c1a7c5543f3eadc66",
    "assets/equations/EQ-12.png": "6b858913268fafc9e7017964497725ae414ba92be79d28e0b68d0986800f06f5",
    "assets/equations/EQ-13.png": "0e9650d3189426e7b8f797c321a2e39e44cb968b232be8cefca3439fc5eb4638",
    "assets/equations/EQ-14.png": "e38c301e5a78edf5ee400d2ec940a95ce7f57deb181b9cce693f923c0e5ee0e2",
    "assets/equations/EQ-15.png": "5dbec747365cfe276569dd54fcd647325eb03bdc21fd8d0685c17e4418a5705c",
    "assets/equations/EQ-16.png": "01ef5b58a59a783bd1cba56f7aa2588d1f0c47a0073123159e4e4173f8a607d5",
    "assets/equations/EQ-17.png": "4157b55d9c5bb2e8f8d91d503d60b464ed434557732254d4ce7e3a68508976b1",
    "assets/equations/EQ-18.png": "8d60c374f397bd70eb88e3de8bbb73b8dd4ff34b57234d1e1bf94dd27c43c415",
    "assets/equations/EQ-19.png": "fb30f9d2dc5b867dfe802b18588454b4e880332d8367651830ccdc1efd3e455d",
    "assets/equations/EQ-20.png": "81fd69b918bfd7aea68981a50f4e9027131ab4c151f0df501fc97aed388f742c",
    "assets/equations/EQ-21.png": "861be3c704f156c741d8d741599befa599ea357ad2385386f464165a0e5f03f4",
    "assets/equations/EQ-22.png": "09a05eb2010a951cbb032f7e9c325ceb341972c567f44e12f45ea96f7271f872",
    "assets/equations/EQ-23.png": "3c2044bf0082cbf341a29e820a1a790a380da64d24fa4b6226ba4d75fcd088c1",
    "assets/equations/EQ-24.png": "2bc4f86ee9b06fbf7445780d2359fff308869c274067467d2fc059b425b6440a",
    "assets/equations/EQ-26.png": "e4a90eb8e742143b8892034504cb4882f8e4aeadc3c5034383ca4f6cf1429512",
    "assets/equations/EQ-27.png": "38f868d390354a2582e95884b4c7ecc0b6044bc9117f2a2d7ffb5df96e95ea09",
    "assets/equations/EQ-28.png": "7d81a3bf4c1d1352ecb74e0daada5866bfa9c6eaf768d1808310de2e29c4b8b3",
    "assets/equations/EQ-29.png": "820a71556bae2b8d4af2e49884d39638645dc5a8f2506fe7b3c50825635d5acc",
    "assets/equations/EQ-30.png": "a46f78a061d0269b6b792ac9891e77007df3ddfc14b850b15c6d127194a82693",
    "assets/equations/EQ-31.png": "ff2a72594370e2d0d5f2666b6d376510085630b8118a39ca3fa3e6df51c7586e",
    "assets/equations/EQ-32.png": "75c891a02558d929ab52bd4b90498319f16ac1307062f0dede5995424a02719a",
    "assets/equations/EQ-33.png": "3945a5bb4a83e90860f2c2af7d3208da739f11113ba59c2cfff4c0aac9fef6c1",
    "assets/equations/EQ-34.png": "05b660b64e94c71cb980b3bb3429ad300c284526637339ddbd17d44bdb5c2db5",
    "assets/equations/EQ-35.png": "cb57d45fed79d092c35efa76c591fe6caa26fdc265fff9ea05f81f6d0c3aa641",
    "assets/equations/EQ-36.png": "bb9f9ffedb76c34a5f8a4a733756b0398339d9cba76050d12ba8a5b30563bff4",
    "assets/equations/EQ-37.png": "c3c69e2053ad6192de60758e51a53e5b32945cd32cd2bbf19dbd079fde7f43ab",
    "assets/equations/EQ-38.png": "92eea9f0c03a3b5fbd4a3df807522148050b5ffa68207390480357ac89b04164",
    "assets/equations/EQ-39.png": "a73b037d4d459bd9a5b156fc0a781f47dafcb800f953f6515dd536b15132c6be",
    "assets/equations/EQ-40.png": "b30316a7f9fd9e123056fd8bdb1ffd6b03e0c68292799cfccd920e74fe220f3f",
    "assets/equations/EQ-41.png": "7408e9655bcd4e631c42145d3050efb3e0cdf6037dc0e45d9452338f3a7a70f2",
    "assets/equations/EQ-42.png": "720428e39b173bd169df5d71859196ab6e81cf30c45fff536af88afb43ddf7f9",
    "assets/equations/EQ-43.png": "6a0e4f0a8201593935de3cb014e4590068b058c01995420b354cacde46f2680c",
    "assets/equations/EQ-44.png": "880489803111d154746bf329c50ffb084372752fad7f165f96d10f644ad611a2",
    "assets/equations/EQ-45.png": "cad9fe41f70611423f8a864a1e0e2ebcb15ee4d4967090991702def1895d26f9",
    "assets/equations/EQ-46.png": "4d037ccc593c793e37c10d53b7e50914e289efaa430d8a62c02910925d77bd01",
    "assets/equations/EQ-47.png": "7a8365189d62df2747394a1e66759f7e7c6888ff478e6d603be9a6206f2a2ca5",
    "assets/equations/EQ-48.png": "c39d1df33e017fb20035677e3107b52a865c56da79fc4bc3923f6646766cd045",
    "assets/equations/EQ-49.png": "1c02978b23c8aca321c5f4031e00acb7460b3787bf64983382566f2fa561fc7a",
    "assets/equations/EQ-50.png": "20e164fb2c40f6c91a3326a4768f46d0bad42e30db09f58dedc9952d636dc338",
    "assets/equations/EQ-51.png": "defd4f641452d18a094f7851ed5fe03864dc94234b4f658bc6c34cda7ad9536f",
    "assets/figures/crop_F01_p4_642x253.png": "a77f01d3c024713666dab3c3723b1af574695a39995d96dedd77ec5625088fa0",
    "assets/figures/crop_F02_p7_526x385.png": "4e60c133c9f8e7ac28b269c44eaa87db32a8e1b260dc293e6deaed6c5c95022e",
    "assets/figures/crop_F03_p12_1100x817.png": "5c0eedf8af62e26c9e6370c8a797fcf23b3b0bcaf86479925ed480c4f0d9ec36",
    "assets/figures/crop_T01_p6_769x879.png": "3b85614cb8f0aa46b1d647ec792650ce5653da945e87d67fc196a6a257b4c883",
    "assets/figures/crop_T02_p13_834x875.png": "53c84909372d02ddb11f3a59d2790ac3d8cb759a8296ee1bd0a9d77bedfd2f1f",
    "assets/figures/crop_T03_p14_959x899.png": "48588b591f357e1447dffdd932933592e06adee679c79f9833dcd3242d6ed885",
    "assets/figures/crop_T04_p14_959x897.png": "b71e085aeb6d4fbda604a56d365b9d605b72f999b8c9c638eff0c48edfaca50f",
    "assets/figures/v3_F01_p4_1254x597.png": "e365b4f17d63016e6c9fdc9fe4057306a485207317a316e84b80a377c0f56a39",
    "assets/figures/v3_F02_p7_1224x750.png": "2636d67cb650a6fda221e50e2e2f4fdfa4659cbf999f7d85c8dcb89de58ee4ad",
    "assets/figures/v3_F03_p12_1224x1055.png": "e283f76b54efa872a64c9f81ebf6d45629299e742c543fd59d25932445ffa53a",
    "assets/figures/v3_T01_p6_1224x551.png": "f85b6cbc5690f061676046b3733cccdc6e80d17b8f48222f39e174e420c916f8",
    "assets/figures/v3_T02_p13_1224x413.png": "8a38c3b57fb37c632e0b55cf8ef6f4e1b64ee0a941ee590e52e3296cdfb708c9",
    "assets/figures/v3_T03_p14_1224x414.png": "4b0b56fc256eaff7c2b942f6f9ee99c7169d2951a25de96e538f8f983329f243",
    "assets/figures/v3_T04_p14_1224x413.png": "a94937fefedb61535acd4b42348018e1042af1b7ca5ebfdb14603a7bb70a3af6",
    "model/figure_inventory.json": "5c4570ac709a954a7b0804b9781465810ff911debaa98aeddac636d91ba0c4e3",
    "model/paper_understanding_draft.json": "55607fb18f8b13e0e8b2bb7953642a6a3211b4964e4badfbbe0a2b1808d3ac88",
    "model/source_map.json": "bf5eb0b57e24a063e2fa70562b14b36f11abc624ed90315be8466cd666609f02",
    "source/paper.pdf": "a71f1294a021cebc6939ec977fc073b6d7b4f183950eba761ec55364d30b729f",
    "source_pages/page-001.png": "98382d9344ad1996e5d0f60eafb79a3e645a3655f3120c30aeae8acfe06c8682",
    "source_pages/page-002.png": "1c590b6db5272ea6809be727f666c4e22bb1962a3511473df49eda24909771f4",
    "source_pages/page-003.png": "da9af7818dd51d823b200a82e8403ad65c4c55258717fd618cd3ac5fbdfdbd48",
    "source_pages/page-004.png": "78be722771d9676331fe755e2fde7bc6fff1d85b725567f4443f628cb7dc1ed5",
    "source_pages/page-005.png": "2326365254c9af8beb8e38f6a41165cc63bdbe354646098124ceba3602cc7d5c",
    "source_pages/page-006.png": "e02113d651480bef0c0a5fc617f684e91a4c598fb429c1652858783d16e0a058",
    "source_pages/page-007.png": "05711662d2af0d26f517abd292850f41f5a57d342cc235d29fb8cbac6288c110",
    "source_pages/page-008.png": "ad3d1f59718ad03faf811bc667bb01bb7ef5bdf5bbefabc7c8faaf9f94e78e50",
    "source_pages/page-009.png": "fb2e505ec993fbdcee4ae742ca8f68a801b20c8401a1dc9da622258b51a0440b",
    "source_pages/page-010.png": "e3292979bd648558449b63f4c856397c570e7e571885759c9dbe8ff6c8aceec8",
    "source_pages/page-011.png": "a07b6deb08941e940b0f1041712c6c632fd2731495444ab73977f668bbf08d50",
    "source_pages/page-012.png": "9b176bc643647b9bbf6e3d2af601067ffb52a6664966f4ba26e3e06ce24a9ca4",
    "source_pages/page-013.png": "6ca17bb9db2902fec793f4ae83ceee859e894b3c3dbcf44d7997e37f034b4085",
    "source_pages/page-014.png": "5fae716cfa31493cf15657f856f6cbc5843a34e12f304dc5c6bf7759beeb28a0",
    "source_pages/page-015.png": "42f067814560c089ee4d1f9c2385d13f75b4958d881e566545cb630b01b850ca"
  },
  "output_sha256": "06fa1eb0c05477873ea8794f0f2d70e1e48b3e39e32d889a624afb12a62371c5",
  "envelope_sha256": "3d13ba29482697a6672d06765814c73999defdd25fb5d5a9d3948dd42294c0cf",
  "target_output": "lens_v3/reproducibility_implementation.json",
  "executor": {
    "kind": "HOST_AGENT",
    "host": "pi",
    "host_version": "frozen-v3",
    "provider": "magpie",
    "model": "antigravity/gemini-3.8-flash",
    "model_version": "canonical-high",
    "reasoning_profile": "high",
    "tool_profile": "paper-only-isolated-snapshot",
    "started_at": "2026-10-05T14:34:47.369360+00:00",
    "completed_at": "2026-10-05T14:34:47.369360+00:00"
  },
  "receipt_sha256": "8300098a5981e81643c39d2d5abb283fa9e2b5dd9e74f1fbc09a0c34cdc24d6b"
}
