{
  "schema_version": "1.0",
  "receipt_id": "c7589c8f-a009-44b6-83d2-879568c678b0",
  "accepted_at": "2026-10-14T12:24:51.293123+00:00",
  "execution_id": "bf7336da-a30f-42a4-8901-f726bd16db3f",
  "dispatch_sha256": "6a66e74341aeef6687005f5e227c086d3c9ed86a253d855f30356123f47b2fec",
  "task_id": "TASK-V3-LENS-METHOD_STUDY_DESIGN",
  "task_sha256": "180776d331a38ecb8d295986c5aef165b5a02aa609adb73da2e112f12cdeff79",
  "code_sha": "ddce2646389265c20fa2d265555239ac62a5d5f4",
  "input_hashes": {
    "assets/equations/EQ-01.png": "21eaa3486113df1efeedb17d363bed5f252ba838efdd8ff255f2a0b01590bf80",
    "assets/equations/EQ-02.png": "fc3d6d85e48278c4037191993558bc0a081dc363a1cf01859b5b2f664f35c3f8",
    "assets/equations/EQ-03.png": "fd7c0c27846baee5b732f7c704d45c8814cffa9e3ca2ed7f82b30da1592d632d",
    "assets/equations/EQ-04.png": "ac297d3c759b7475e9498831e001b927003588f6c0747e448f43cc7844f7e8a9",
    "assets/equations/EQ-05.png": "def0022ab6d2c4fbd3f95a8b625dcc8e761ef045d6459ee43e0835341261d494",
    "assets/equations/EQ-06.png": "7d76647ccf0e04e581445afbbddfda2c5376bdc55a81e3857bb76b49a3fc05e1",
    "assets/equations/EQ-07.png": "4aadaedf1b20514065bed3f44ae7b1ba075697e8689a879a130b732a66408adf",
    "assets/equations/EQ-08.png": "1a4163f01f80ae1f2bfab4817df0a04c73855c93631dc8071e6b69fee293cbde",
    "assets/equations/EQ-09.png": "b0cf8db82075df72a110f74b4991ff4ea81f74628674c74fea1cf5a18cafa0cc",
    "assets/equations/EQ-10.png": "0a202fa1a0ee91e999c1b64f93a803dec782afba0c040faf92e75e221bfe6380",
    "assets/equations/EQ-11.png": "9642c6efbc131e50a05d98219af0aa67317c4ce1a5d95b4e76a2d182a9a15f95",
    "assets/equations/EQ-12.png": "d35dc83944ec8fcf13713ebd648fd69ea9a582becd5ec2a55b01e6e075f2544e",
    "assets/equations/EQ-13.png": "c9b33b7dbd5cbf6e3d682f38dbf4261a5673053c214ef0b2344c04eff9b7f797",
    "assets/equations/EQ-14.png": "c44d6a7d8f4ab6f19dece47ccc527cd62723848988757e2a31459e30ce246aca",
    "assets/equations/EQ-15.png": "b6a6423eddc19bb845ede016235561de0f3fe7324559ac580141041deb4f4824",
    "assets/figures/crop_T01_p9_923x898.png": "c7341834afa3f14591a43c77843fd12fbd07c8ae2d277232d6e21d9ea605d670",
    "assets/figures/crop_T02_p11_790x449.png": "d8969c912a63a71f6a5627204d466891bed455e6116c0750826e61e83f730cc5",
    "assets/figures/crop_T03_p12_729x905.png": "a2f38d60ab5cb2e775e3b0c21d92290da551fa534378234b4147fb137f39c5ff",
    "assets/figures/crop_T04_p12_729x679.png": "c3fde66ea59ca5e557f3c7b36a72095fe66b5f120f95d2320c99677b876d68bc",
    "assets/figures/crop_T05_p13_885x902.png": "0e4ab58368344898ac27d75dda5ff474448bc44014a342412e6cb6202793e359",
    "assets/figures/crop_T06_p13_1011x900.png": "7439b8e14a7d8617cbe799c718f2ea371312323221b02e9087dd0ee2c404dae2",
    "assets/figures/crop_T07_p14_907x908.png": "137eb96614c01cba895504155170673be16056de21860c1b4b4cdccb511f4894",
    "assets/figures/crop_T08_p14_908x892.png": "7e0af4708339120de71246a5535b669eaaca44cd9af4710278eb98638213a665",
    "assets/figures/crop_T09_p14_902x630.png": "f1296156f052c98943aea930d408106be077794684dd496c028b92af36e4cb9d",
    "assets/figures/crop_T10_p14_1415x925.png": "e5afe1fa210e678f85c401600aa0a57b19986e82f2315489d5f9b93e397d641f",
    "assets/figures/crop_T11_p19_943x881.png": "a123f750bd820c47e07e2d373e3f779cddb00c1a0de6664cdec0b3efa12c205f",
    "assets/figures/fig01_p2_3988x2475.png": "1fe4297b101c6aa6899189df63ab41c57ef8c9895af76d570052d7b995925dc7",
    "assets/figures/fig02_p4_4594x1975.png": "8a6672af85de62cb793ea4595c13bf641761c8b40a2f9d0c318f70014fdd76f5",
    "assets/figures/fig03_p6_2481x2264.png": "efff1582b4531bf5746e0a5f313f9681ee470a2ad12e7aa9043f1a1ec409eb38",
    "assets/figures/fig04_p7_1684x1946.png": "fb40692f9e81d978e51af4659c4b5346e134a2c2a0ae2f08daf506d42fef2f0f",
    "assets/figures/fig05_p8_4400x1393.png": "e628b517629c6a8b1cbf0e56adc7710b632ec6ea5b35b25559759f7ce55c9f6d",
    "assets/figures/fig07_p10_4401x2227.png": "f4c0d065ec0c36e1f54f3867e13106fa3f5bb8e4122d615e5c0a1584706329ac",
    "assets/figures/fig08_p10_1482x1739.png": "dfce15370586734422d1bef798cc5a1cb0182eae58ce593f0478e4fe6d487433",
    "assets/figures/fig10_p11_3665x1903.png": "61aaf4173ed866817a752f19d30033e10ffdaedf6d55b7cfe0004359d17340f0",
    "assets/figures/fig15_p13_1384x1140.png": "82655c147517b41c689dbafd679dfead43f46848dc75e2f33ce312f63fa3b9db",
    "model/figure_inventory.json": "92dc45feea29174deb08381bef9be197bece447608d5b36d1e530af074fb340b",
    "model/paper_understanding_draft.json": "9036b3e1e1575dfaad4cd49908a18e8236215985a834e9b97438c7abde86b1df",
    "model/source_map.json": "4896364e0876b7929242eac2aabb3623507289de4eb18cdc7ccfc05f0a4cf1d4",
    "source/paper.pdf": "32df5e2843de7e8ccd52d56b9dfed257c26786ef3b71fbc397a1c3a5e26fb0fa",
    "source_pages/page-001.png": "c61cbc77e6d1f179ae2a54ddb65dd569d5c129ec42ae4569e6377d003e4445d3",
    "source_pages/page-002.png": "ff35bc2f85b6d4741b7521dc07d84b609160761081c347e2754604beb8d9dc7e",
    "source_pages/page-003.png": "74aed6409860a243766a2af5b23a7ecc283dbb52ff426a06c4775c4012603704",
    "source_pages/page-004.png": "aeaefa0ec81adf5834a0e620ba2251ef1f0dea71f376542717fd2109f7cc79ce",
    "source_pages/page-005.png": "a0ca7b865ee214c66d1b0ea87dd74e26a62b3835602129d8619689dd7057fb7d",
    "source_pages/page-006.png": "135f7e08a6a119233c4302b9467e282a36dea7168fdff334b7ceba0ea908ec06",
    "source_pages/page-007.png": "d70828bc8ea39087d58b8c134bfbf68d42040281fe5144afe5517e81e479852b",
    "source_pages/page-008.png": "900f70f5f1f98cf0622889d98a2d8a5e732e5d8e8969ac056796fe53112aafca",
    "source_pages/page-009.png": "0d8c3e1e4e9dac3266dd4376e227f37ccff2e132c92bd2a4091a9aaaf2ad0fbb",
    "source_pages/page-010.png": "bbd9cc082e40e3da42caeb0aa97c3afaee7de0bb029bd98120172cfbd94c92a2",
    "source_pages/page-011.png": "f30ad8f07f72c3dde28a3583424a3de647bcf58119616bacaa45f6c009f83d8e",
    "source_pages/page-012.png": "4859070994bf4267eee596764b6ff612e976aef578c373813ad46c83a057e9ea",
    "source_pages/page-013.png": "f4d98952a7ecfcee8ec01e04cc1a54da23953a8d959b1d95ad16ca3cb6ba653f",
    "source_pages/page-014.png": "b089e3221a4a57257612c604a02dca265e7dc81305057b640dc20ed2013c4040",
    "source_pages/page-015.png": "99b83bb404ae0341ab50fe17b74635f584889befe819876403a5cfcce20e2ec4",
    "source_pages/page-016.png": "7fbc301a73abe5c97e9f82e95e4b80eae58748135874ea83f6e5d62daa06b0d9",
    "source_pages/page-017.png": "9496f719c019dc4ce6c7dc21e9e9241b2613cbcc55e6968e3dd3ba99f5036756",
    "source_pages/page-018.png": "9e52d5b2e6c189fa34bc72eb75a5b3e930a137d028ed8294aa440e63f9631e2e",
    "source_pages/page-019.png": "4dbe38ad6cba2d12e48d86bd4df203c6af38cf0191b595117ec3855199f0bc86",
    "source_pages/page-020.png": "800c78e164bf019dbf6bf1c1a20bee5e1a4a9af222107a1e032944071c3bcaa0"
  },
  "output_sha256": "d6618e337df961315caa8f95b4a32dda9dc64703f339b739aca40a3d04350e49",
  "envelope_sha256": "76a687d53732cd12109baccfc8840387a0ea9a63116d7fa7e31c3b40b236106a",
  "target_output": "lens_v3/method_study_design.json",
  "executor": {
    "kind": "HOST_AGENT",
    "host": "antigravity",
    "model": "antigravity/gemini-3.8-flash",
    "started_at": "2026-10-14T12:24:50.508166+00:00",
    "completed_at": "2026-10-14T12:24:50.508166+00:00",
    "tool_profile": "paper-only"
  },
  "receipt_sha256": "eded315f0bc33812bed1164c7ac041cb889e4e9059d5387132e8cc2f8e587af0"
}
